<!ELEMENT catalogo (producto+)>
<!ELEMENT producto (nombre, marca, categoria, precio)>
<!ATTLIST producto id CDATA #REQUIRED>
<!ELEMENT nombre (#PCDATA)>
<!ELEMENT marca (#PCDATA)>
<!ELEMENT categoria (#PCDATA)>
<!ELEMENT precio (#PCDATA)>